{
  "$schema": "../../schemas/thx-base-audio-prerequisites.schema.json",
  "manifestType": "OpenBlade.ThxBaseAudioPrerequisites",
  "schemaVersion": 1,
  "status": {
    "evidence": "SourceVerified",
    "installation": "InstallationUnvalidated",
    "provisioningImplemented": false
  },
  "intel": {
    "models": [
      "RZ09-0581"
    ],
    "source": {
      "updateId": "04ff47e5-1b36-42e9-bc4a-af4954a217be",
      "detailUrl": "https://www.catalog.update.microsoft.com/ScopedViewInline.aspx?updateid=04ff47e5-1b36-42e9-bc4a-af4954a217be",
      "downloadUrl": "https://catalog.s.download.windowsupdate.com/d/msdownload/update/driver/drvs/2026/02/6980ba42-6b23-4156-8c81-ab8ec2466d12_7f51f5eabbc0ee293e12ac3c2980a64d2d994651.cab",
      "cabSize": 33406870,
      "cabSha256": "BC77F3E1371C05BFE4EE68E70E4BE6A06F352143043FF0195FF92F23B8B6CDF3"
    },
    "catalogHardwareIds": [
      "INTELAUDIO\\DIF_0005&UIF_0000&SDW_CTLR_DEV_E328&VEN_8086&DEV_0333",
      "INTELAUDIO\\SDW_CTLR_DEV_E328&VEN_8086&DEV_0333"
    ],
    "exactObservedChain": [
      "PCI\\VEN_8086&DEV_E328&SUBSYS_30101A58&REV_00",
      "INTELAUDIO\\DSP_CTLR_DEV_E328&VEN_8086&DEV_0222&SUBSYS_30101A58&REV_0000",
      "INTELAUDIO\\SDW_CTLR_DEV_E328&VEN_8086&DEV_0333&SUBSYS_30101A58"
    ],
    "activePublishedInfBindings": [
      "IntcAudioBus.inf=20.43.12634.0",
      "IntcOED.inf=20.43.12634.0",
      "IntcSdwBus.inf=20.43.12634.0"
    ],
    "activeInfByteMatchesOfficialCab": true,
    "root": "IntcAudioBus.inf",
    "copyInf": [
      "IntcOED.inf",
      "IntcSdwBus.inf",
      "IntcUSB.inf",
      "IntcBTAu.inf",
      "IntcDMic.inf",
      "IntcSST.inf",
      "DetectionVerificationDrv.inf",
      "IntcSSDW.inf",
      "IntcSBtLe.inf"
    ],
    "packages": [
      {
        "inf": "IntcAudioBus.inf",
        "driverVer": "02/18/2026,20.43.12634.0",
        "catalog": {
          "file": "IntcAudioBus.cat",
          "size": 31999,
          "sha256": "364B804D4AB699BA633097300B7E1D49C840B24F558637E2FA3D7E15F4B225E6",
          "status": "Valid",
          "signer": "CN=Microsoft Windows Hardware Compatibility Publisher, O=Microsoft Corporation, L=Redmond, S=Washington, C=US",
          "thumbprint": "32B4E7CE92A59C722B8BDF7AE3E66520CFB9DE21",
          "issuer": "CN=Microsoft Windows Third Party Component CA 2012, O=Microsoft Corporation, L=Redmond, S=Washington, C=US"
        },
        "files": [
          {
            "path": "IntcAudioBus.inf",
            "size": 31854,
            "sha256": "F5B56910FE18060C327782E47516864DF8A01FAED92F8A6536A051DCD342CB43",
            "catalogMembership": "Verified"
          },
          {
            "path": "IntcAudioBus.sys",
            "size": 366048,
            "sha256": "6B868FEA974FC806E35BBDB8C5CF21B70EA46764CDF0D811A6BDABA0D70ABD6C",
            "catalogMembership": "Verified"
          }
        ]
      },
      {
        "inf": "IntcOED.inf",
        "driverVer": "02/18/2026,20.43.12634.0",
        "catalog": {
          "file": "IntcOED.cat",
          "size": 57872,
          "sha256": "C4EDCDBC98004E2D44D2B168518D2828B8A8F7AA8CEEA8A3EB60AB9902C73046",
          "status": "Valid",
          "signer": "CN=Microsoft Windows Hardware Compatibility Publisher, O=Microsoft Corporation, L=Redmond, S=Washington, C=US",
          "thumbprint": "32B4E7CE92A59C722B8BDF7AE3E66520CFB9DE21",
          "issuer": "CN=Microsoft Windows Third Party Component CA 2012, O=Microsoft Corporation, L=Redmond, S=Washington, C=US"
        },
        "files": [
          {
            "path": "IntcOED.inf",
            "size": 69302,
            "sha256": "7C0CB7B335F022B038C07CB40342A97D9BC46EBAF53DD5AADC406F8430384368",
            "catalogMembership": "Verified"
          },
          {
            "path": "IntcOED.sys",
            "size": 1528800,
            "sha256": "061FCF9AA69D1405D546B29D03818AC75DF86A4D3FBB808D3C9EC6D41E89AC34",
            "catalogMembership": "Verified"
          },
          {
            "path": "Topology\\IntcOEDTopology.oec",
            "size": 58449,
            "sha256": "F5533FB888AAAEAD38809934C28FA462A2FD754C3154A7775B15FE6C710A7CC9",
            "catalogMembership": "Verified"
          },
          {
            "path": "Topology\\IntcOEDTopology.xml",
            "size": 47504,
            "sha256": "823EE148393CDC5493DE6B4399E8A49B533D16192F5B7295E01C812F8C406A80",
            "catalogMembership": "Verified"
          },
          {
            "path": "Fw\\dsp_fw_release.bin",
            "size": 788656,
            "sha256": "B998304636A4EC545AB4A724168A5FEA9FA46713213D63AFBD2928577E2ED3FA",
            "catalogMembership": "Verified"
          },
          {
            "path": "Libs\\dsp_lib_intel_wov_release.bin",
            "size": 102524,
            "sha256": "313C4E0D9CF99A1A070569483E30C3EA644F37FD28BED16E0D81E153ED09EB67",
            "catalogMembership": "Verified"
          },
          {
            "path": "Libs\\dsp_lib_whm_release.bin",
            "size": 114816,
            "sha256": "7EDB2A2CD9DBE84DDEBB7E2E0FAE045D398FC33BA9AB2AF6AE563082A99E3869",
            "catalogMembership": "Verified"
          },
          {
            "path": "Libs\\dsp_lib_nld_release.bin",
            "size": 57428,
            "sha256": "032B5C4989C3D0E22FA80B5CBB07957735BFDD8437F26994C59DCF9A8BE59E74",
            "catalogMembership": "Verified"
          },
          {
            "path": "Libs\\dsp_lib_asrc_release.bin",
            "size": 73836,
            "sha256": "CE64AF0534B333E167FD19C653A38C21CD5E520103D6A5C143393E501D3ECD9B",
            "catalogMembership": "Verified"
          },
          {
            "path": "Libs\\dsp_lib_psns48k_release.bin",
            "size": 217196,
            "sha256": "066318276A9AB10259B1AD21696750F64AC12777D9F744E219BE4D2DB60B9C08",
            "catalogMembership": "Verified"
          },
          {
            "path": "Libs\\dsp_lib_psns96k_release.bin",
            "size": 237676,
            "sha256": "B4618ABE4398E92A3585B3A5EDCBB6F66403EED3E07F1C57DC1615BF2126C728",
            "catalogMembership": "Verified"
          },
          {
            "path": "Libs\\dsp_lib_intel_aca_release.bin",
            "size": 340052,
            "sha256": "53AFBBEA2534A8D9F25FA13258FCA1D0141B3091BFACB8E74104F6225D94F1B4",
            "catalogMembership": "Verified"
          },
          {
            "path": "WoV\\intelwov_data_manifest.txt",
            "size": 10,
            "sha256": "11398CC424F4E41F39900E6E4F86DA75030D2556FB782C32BFF81E4CF9813C04",
            "catalogMembership": "Verified"
          },
          {
            "path": "WoV\\model_metadata_PTL.xml",
            "size": 2569,
            "sha256": "DC276EB1C540D395C3E7F01BC74CF1CC2CE0B7D82EA4390EEC81236655D1DF3B",
            "catalogMembership": "Verified"
          },
          {
            "path": "WoV\\WoV_Externals_PTL_IntelWoV_3.1.242.0_405.txt",
            "size": 51,
            "sha256": "148CFFAE752D9113942084EBD73C4A2F45C84FE2CE10B4DC74CD698939D522AF",
            "catalogMembership": "Verified"
          },
          {
            "path": "WoV\\Ms\\m\\en-US\\ms_en-US_ex.eth",
            "size": 5,
            "sha256": "37A59654C915A7BC76C681A19E69F102A7B09BEDD35987AF033A343ACF69606C",
            "catalogMembership": "Verified"
          },
          {
            "path": "WoV\\Ms\\m\\en-US\\ms_en-US_ex.hsc",
            "size": 3721612,
            "sha256": "4FB9C2C75CE3BA49DECE62B004EC6291826C188C4D0DCCB10BA05605AD93FA9D",
            "catalogMembership": "Verified"
          },
          {
            "path": "WoV\\Ms\\m\\en-US\\ms_en-US_ex.th",
            "size": 5,
            "sha256": "11A68BE99E8C26AABC0B8F35727CF647AAC798A6F3BECCDE0350B0B7D8A344F8",
            "catalogMembership": "Verified"
          },
          {
            "path": "WoV\\Ms\\m\\en-US\\ms_en-US_hq.gna",
            "size": 142300,
            "sha256": "1C7F3F684EF5BDD5DF3F9D1F43FE99F2977892190A63829F4260110F2EEAA76E",
            "catalogMembership": "Verified"
          },
          {
            "path": "WoV\\Service\\MultiChannelWoV.dll",
            "size": 847840,
            "sha256": "CD946037EC7FE158225CEDD1475487B3E5624B29B675F0C641459FA9AE961989",
            "catalogMembership": "Verified"
          },
          {
            "path": "WoV\\Service\\MultichannelWoVCfg.dll",
            "size": 296416,
            "sha256": "48AC6286BA72DE785FF322D295900D053A1276BFA387FC558843E53E4E180EDB",
            "catalogMembership": "Verified"
          },
          {
            "path": "WoV\\Tencent\\m\\zh-CN\\tencent_zh-CN_ex.eth",
            "size": 4,
            "sha256": "B720401FC5F0A1962C830B14132F12C2B376F2CCA823B2EFBAF226167720251E",
            "catalogMembership": "Verified"
          },
          {
            "path": "WoV\\Tencent\\m\\zh-CN\\tencent_zh-CN_ex.hsc",
            "size": 894326,
            "sha256": "18348C63A18D880DEA0165907CDB4C387F323D0E5D2DA0E103B2E67D3D3514BA",
            "catalogMembership": "Verified"
          },
          {
            "path": "WoV\\Tencent\\m\\zh-CN\\tencent_zh-CN_ex.th",
            "size": 4,
            "sha256": "B720401FC5F0A1962C830B14132F12C2B376F2CCA823B2EFBAF226167720251E",
            "catalogMembership": "Verified"
          },
          {
            "path": "WoV\\Tencent\\m\\zh-CN\\tencent_zh-CN_hq.gna",
            "size": 139996,
            "sha256": "A26F7A8FE12B102A07261173D49F5EC6288885389FC417B6DB6FA0BD7E8DD408",
            "catalogMembership": "Verified"
          },
          {
            "path": "WoV\\Xiaomi\\m\\zh-CN\\xiaomi_zh-CN_ex.eth",
            "size": 2,
            "sha256": "4A44DC15364204A80FE80E9039455CC1608281820FE2B24F1E5233ADE6AF1DD5",
            "catalogMembership": "Verified"
          },
          {
            "path": "WoV\\Xiaomi\\m\\zh-CN\\xiaomi_zh-CN_ex.hsc",
            "size": 1929454,